[
  {
    "userLabel": "GigabitEthernet 0/2/0",
    "direction": "D_NA",
    "name": "GigabitEthernet-0-2-0",
    "alarmStatus": "Indeterminate",
    "containedCTPs": [],
    "transmissionParams": [
      {
        "layer": "LR_PHYSICAL_OPTICAL",
        "layerInUse": true,
        "potentialFutureSetupIndicator": "RSU_POINT_TO_POINT",
        "thisLayerActive": "ACTIVE",
        "serviceState": "IN_SERVICE",
        "location": "",
        "alarmReporting": "on"
      },
      {
        "layer": "LR_OPTICAL_SECTION",
        "layerInUse": true,
        "potentialFutureSetupIndicator": "RSU_POINT_TO_POINT",
        "thisLayerActive": "ACTIVE",
        "serviceState": "IN_SERVICE",
        "location": "",
        "alarmReporting": "on"
      },
      {
        "layer": "LR_Optical_Channel",
        "layerInUse": true,
        "potentialFutureSetupIndicator": "RSU_POINT_TO_POINT",
        "thisLayerActive": "ACTIVE",
        "serviceState": "IN_SERVICE",
        "location": "",
        "alarmReporting": "on"
      },
      {
        "layer": "LR_DSR_10Gigabit_Ethernet",
        "layerInUse": true,
        "potentialFutureSetupIndicator": "RSU_POINT_TO_POINT",
        "thisLayerActive": "INACTIVE",
        "serviceState": "IN_SERVICE",
        "location": "",
        "alarmReporting": "on"
      },
      {
        "layer": "LR_DSR_Gigabit_Ethernet",
        "layerInUse": true,
        "potentialFutureSetupIndicator": "RSU_POINT_TO_POINT",
        "thisLayerActive": "ACTIVE",
        "serviceState": "IN_SERVICE",
        "location": "",
        "alarmReporting": "on"
      },
      {
        "layer": "LR_Ethernet",
        "layerInUse": true,
        "potentialFutureSetupIndicator": "RSU_POINT_TO_POINT",
        "thisLayerActive": "ACTIVE",
        "serviceState": "IN_SERVICE",
        "location": "",
        "alarmReporting": "on"
      },
      {
        "layer": "LR_CLIENT_ERP",
        "layerInUse": true,
        "potentialFutureSetupIndicator": "RSU_POINT_TO_POINT",
        "thisLayerActive": "ACTIVE",
        "serviceState": "IN_SERVICE",
        "location": "",
        "alarmReporting": "on"
      }
    ],
    "serviceState": "OUT_OF_SERVICE",
    "oids": [],
    "connectionState": "NA",
    "adminState": "AdminAutoInService",
    "owner": "",
    "nativeEmsName": "",
    "type": "TPT_PTP",
    "id": "GigabitEthernet-0-2-0",
    "tpMappingMode": "TM_NA"
  },
  {
    "userLabel": "GigabitEthernet 0/2/1",
    "direction": "D_NA",
    "name": "GigabitEthernet-0-2-1",
    "alarmStatus": "Indeterminate",
    "containedCTPs": [],
    "transmissionParams": [
      {
        "layer": "LR_PHYSICAL_OPTICAL",
        "layerInUse": true,
        "potentialFutureSetupIndicator": "RSU_POINT_TO_POINT",
        "thisLayerActive": "ACTIVE",
        "serviceState": "IN_SERVICE",
        "location": "",
        "alarmReporting": "on"
      },
      {
        "layer": "LR_OPTICAL_SECTION",
        "layerInUse": true,
        "potentialFutureSetupIndicator": "RSU_POINT_TO_POINT",
        "thisLayerActive": "ACTIVE",
        "serviceState": "IN_SERVICE",
        "location": "",
        "alarmReporting": "on"
      },
      {
        "layer": "LR_Optical_Channel",
        "layerInUse": true,
        "potentialFutureSetupIndicator": "RSU_POINT_TO_POINT",
        "thisLayerActive": "ACTIVE",
        "serviceState": "IN_SERVICE",
        "location": "",
        "alarmReporting": "on"
      },
      {
        "layer": "LR_DSR_10Gigabit_Ethernet",
        "layerInUse": true,
        "potentialFutureSetupIndicator": "RSU_POINT_TO_POINT",
        "thisLayerActive": "INACTIVE",
        "serviceState": "IN_SERVICE",
        "location": "",
        "alarmReporting": "on"
      },
      {
        "layer": "LR_DSR_Gigabit_Ethernet",
        "layerInUse": true,
        "potentialFutureSetupIndicator": "RSU_POINT_TO_POINT",
        "thisLayerActive": "ACTIVE",
        "serviceState": "IN_SERVICE",
        "location": "",
        "alarmReporting": "on"
      },
      {
        "layer": "LR_Ethernet",
        "layerInUse": true,
        "potentialFutureSetupIndicator": "RSU_POINT_TO_POINT",
        "thisLayerActive": "ACTIVE",
        "serviceState": "IN_SERVICE",
        "location": "",
        "alarmReporting": "on"
      },
      {
        "layer": "LR_CLIENT_ERP",
        "layerInUse": true,
        "potentialFutureSetupIndicator": "RSU_POINT_TO_POINT",
        "thisLayerActive": "ACTIVE",
        "serviceState": "IN_SERVICE",
        "location": "",
        "alarmReporting": "on"
      }
    ],
    "serviceState": "OUT_OF_SERVICE",
    "oids": [],
    "connectionState": "NA",
    "adminState": "AdminAutoInService",
    "owner": "",
    "nativeEmsName": "",
    "type": "TPT_PTP",
    "id": "GigabitEthernet-0-2-1",
    "tpMappingMode": "TM_NA"
  },
  {
    "userLabel": "GigabitEthernet 0/2/2",
    "direction": "D_NA",
    "name": "GigabitEthernet-0-2-2",
    "alarmStatus": "Indeterminate",
    "containedCTPs": [],
    "transmissionParams": [
      {
        "layer": "LR_PHYSICAL_OPTICAL",
        "layerInUse": true,
        "potentialFutureSetupIndicator": "RSU_POINT_TO_POINT",
        "thisLayerActive": "ACTIVE",
        "serviceState": "IN_SERVICE",
        "location": "",
        "alarmReporting": "on"
      },
      {
        "layer": "LR_OPTICAL_SECTION",
        "layerInUse": true,
        "potentialFutureSetupIndicator": "RSU_POINT_TO_POINT",
        "thisLayerActive": "ACTIVE",
        "serviceState": "IN_SERVICE",
        "location": "",
        "alarmReporting": "on"
      },
      {
        "layer": "LR_Optical_Channel",
        "layerInUse": true,
        "potentialFutureSetupIndicator": "RSU_POINT_TO_POINT",
        "thisLayerActive": "ACTIVE",
        "serviceState": "IN_SERVICE",
        "location": "",
        "alarmReporting": "on"
      },
      {
        "layer": "LR_DSR_10Gigabit_Ethernet",
        "layerInUse": true,
        "potentialFutureSetupIndicator": "RSU_POINT_TO_POINT",
        "thisLayerActive": "INACTIVE",
        "serviceState": "IN_SERVICE",
        "location": "",
        "alarmReporting": "on"
      },
      {
        "layer": "LR_DSR_Gigabit_Ethernet",
        "layerInUse": true,
        "potentialFutureSetupIndicator": "RSU_POINT_TO_POINT",
        "thisLayerActive": "ACTIVE",
        "serviceState": "IN_SERVICE",
        "location": "",
        "alarmReporting": "on"
      },
      {
        "layer": "LR_Ethernet",
        "layerInUse": true,
        "potentialFutureSetupIndicator": "RSU_POINT_TO_POINT",
        "thisLayerActive": "ACTIVE",
        "serviceState": "IN_SERVICE",
        "location": "",
        "alarmReporting": "on"
      },
      {
        "layer": "LR_CLIENT_ERP",
        "layerInUse": true,
        "potentialFutureSetupIndicator": "RSU_POINT_TO_POINT",
        "thisLayerActive": "ACTIVE",
        "serviceState": "IN_SERVICE",
        "location": "",
        "alarmReporting": "on"
      }
    ],
    "serviceState": "OUT_OF_SERVICE",
    "oids": [],
    "connectionState": "NA",
    "adminState": "AdminAutoInService",
    "owner": "",
    "nativeEmsName": "",
    "type": "TPT_PTP",
    "id": "GigabitEthernet-0-2-2",
    "tpMappingMode": "TM_NA"
  },
  {
    "userLabel": "GigabitEthernet 0/2/3",
    "direction": "D_NA",
    "name": "GigabitEthernet-0-2-3",
    "alarmStatus": "Indeterminate",
    "containedCTPs": [],
    "transmissionParams": [
      {
        "layer": "LR_PHYSICAL_OPTICAL",
        "layerInUse": true,
        "potentialFutureSetupIndicator": "RSU_POINT_TO_POINT",
        "thisLayerActive": "ACTIVE",
        "serviceState": "IN_SERVICE",
        "location": "",
        "alarmReporting": "on"
      },
      {
        "layer": "LR_OPTICAL_SECTION",
        "layerInUse": true,
        "potentialFutureSetupIndicator": "RSU_POINT_TO_POINT",
        "thisLayerActive": "ACTIVE",
        "serviceState": "IN_SERVICE",
        "location": "",
        "alarmReporting": "on"
      },
      {
        "layer": "LR_Optical_Channel",
        "layerInUse": true,
        "potentialFutureSetupIndicator": "RSU_POINT_TO_POINT",
        "thisLayerActive": "ACTIVE",
        "serviceState": "IN_SERVICE",
        "location": "",
        "alarmReporting": "on"
      },
      {
        "layer": "LR_DSR_10Gigabit_Ethernet",
        "layerInUse": true,
        "potentialFutureSetupIndicator": "RSU_POINT_TO_POINT",
        "thisLayerActive": "INACTIVE",
        "serviceState": "IN_SERVICE",
        "location": "",
        "alarmReporting": "on"
      },
      {
        "layer": "LR_DSR_Gigabit_Ethernet",
        "layerInUse": true,
        "potentialFutureSetupIndicator": "RSU_POINT_TO_POINT",
        "thisLayerActive": "ACTIVE",
        "serviceState": "IN_SERVICE",
        "location": "",
        "alarmReporting": "on"
      },
      {
        "layer": "LR_Ethernet",
        "layerInUse": true,
        "potentialFutureSetupIndicator": "RSU_POINT_TO_POINT",
        "thisLayerActive": "ACTIVE",
        "serviceState": "IN_SERVICE",
        "location": "",
        "alarmReporting": "on"
      },
      {
        "layer": "LR_CLIENT_ERP",
        "layerInUse": true,
        "potentialFutureSetupIndicator": "RSU_POINT_TO_POINT",
        "thisLayerActive": "ACTIVE",
        "serviceState": "IN_SERVICE",
        "location": "",
        "alarmReporting": "on"
      }
    ],
    "serviceState": "OUT_OF_SERVICE",
    "oids": [],
    "connectionState": "NA",
    "adminState": "AdminAutoInService",
    "owner": "",
    "nativeEmsName": "",
    "type": "TPT_PTP",
    "id": "GigabitEthernet-0-2-3",
    "tpMappingMode": "TM_NA"
  },
  {
    "userLabel": "GigabitEthernet 0/2/4",
    "direction": "D_NA",
    "name": "GigabitEthernet-0-2-4",
    "alarmStatus": "Indeterminate",
    "containedCTPs": [],
    "transmissionParams": [
      {
        "layer": "LR_PHYSICAL_OPTICAL",
        "layerInUse": true,
        "potentialFutureSetupIndicator": "RSU_POINT_TO_POINT",
        "thisLayerActive": "ACTIVE",